date,description,amount
2025-03-09,Thousand discover item.,-577.50
2025-01-03,Federal population public local.,767.21
2025-02-06,Indeed relationship sometimes according have.,-376.36
2025-01-17,Collection high get method.,949.92
2025-02-02,Believe real entire reality tree.,782.41
2025-04-21,Least in movement long.,-801.00
2025-04-05,Own executive local.,-197.90
2025-03-06,Provide natural pull travel.,-572.71
2025-04-08,Pretty sing blue no.,718.74
2025-01-16,Dark student station in relationship.,-666.01
